{
  "benchmark_id": "cadquery_benchmark_v1",
  "benchmark_version": "1.0.0",
  "evaluation_schema_version": "2.0",
  "phase": "full",
  "cases": [
    {
      "id": "B013",
      "title": "Chamfered cube",
      "category": "primitive",
      "difficulty": "easy",
      "prompt": "Create a 35 mm cube centered in X and Y with its bottom at Z=0. Apply a 3 mm chamfer to all twelve outer edges, use named parameters, and return one solid.",
      "expected_behavior": "generate",
      "parameterization_required": true,
      "constraints": [
        {
          "id": "overall_dimensions",
          "type": "bbox_dimensions",
          "hard": true,
          "expected_mm": {
            "x": 35,
            "y": 35,
            "z": 35
          },
          "absolute_tolerance_mm": 0.5,
          "relative_tolerance": 0.01
        },
        {
          "id": "centered_bottom",
          "type": "bbox_bounds",
          "hard": true,
          "expected_min_mm": {
            "x": -17.5,
            "y": -17.5,
            "z": 0
          },
          "expected_max_mm": {
            "x": 17.5,
            "y": 17.5
          },
          "absolute_tolerance_mm": 0.5,
          "relative_tolerance": 0.01
        },
        {
          "id": "single_solid",
          "type": "solid_count",
          "hard": true,
          "expected": 1
        }
      ],
      "manual_checks": [
        {
          "id": "all_edges_chamfered",
          "criterion": "All twelve cube edges have a consistent 3 mm chamfer.",
          "scale": "binary",
          "required": true
        }
      ],
      "tags": [
        "primitive",
        "cube",
        "chamfer"
      ]
    },
    {
      "id": "B014",
      "title": "Truncated cone",
      "category": "primitive",
      "difficulty": "easy",
      "prompt": "Create a vertical solid truncated cone with a 50 mm bottom diameter, a 24 mm top diameter, and a height of 40 mm. Center it on the origin, place its base at Z=0, use named parameters, and return one solid.",
      "expected_behavior": "generate",
      "parameterization_required": true,
      "constraints": [
        {
          "id": "overall_dimensions",
          "type": "bbox_dimensions",
          "hard": true,
          "expected_mm": {
            "x": 50,
            "y": 50,
            "z": 40
          },
          "absolute_tolerance_mm": 0.5,
          "relative_tolerance": 0.01
        },
        {
          "id": "base_at_z0",
          "type": "bbox_bounds",
          "hard": true,
          "expected_min_mm": {
            "z": 0
          },
          "absolute_tolerance_mm": 0.5,
          "relative_tolerance": 0.01
        },
        {
          "id": "single_solid",
          "type": "solid_count",
          "hard": true,
          "expected": 1
        }
      ],
      "manual_checks": [
        {
          "id": "taper_direction",
          "criterion": "The cone tapers smoothly from the 50 mm base to the 24 mm top.",
          "scale": "binary",
          "required": true
        }
      ],
      "tags": [
        "primitive",
        "cone",
        "frustum"
      ]
    },
    {
      "id": "B015",
      "title": "Regular hexagonal prism",
      "category": "primitive",
      "difficulty": "medium",
      "prompt": "Create a vertical regular hexagonal prism 30 mm high, centered on the origin, with its bottom at Z=0 and a 40 mm circumscribed-circle diameter. Orient one pair of opposite vertices along X, use named parameters, and return one solid.",
      "expected_behavior": "generate",
      "parameterization_required": true,
      "constraints": [
        {
          "id": "x_and_height",
          "type": "bbox_dimensions",
          "hard": true,
          "expected_mm": {
            "x": 40,
            "z": 30
          },
          "absolute_tolerance_mm": 0.5,
          "relative_tolerance": 0.01
        },
        {
          "id": "base_at_z0",
          "type": "bbox_bounds",
          "hard": true,
          "expected_min_mm": {
            "z": 0
          },
          "absolute_tolerance_mm": 0.5,
          "relative_tolerance": 0.01
        },
        {
          "id": "single_solid",
          "type": "solid_count",
          "hard": true,
          "expected": 1
        }
      ],
      "manual_checks": [
        {
          "id": "regular_hexagon",
          "criterion": "The cross-section is a regular six-sided polygon with the requested orientation.",
          "scale": "binary",
          "required": true
        }
      ],
      "tags": [
        "primitive",
        "polygon",
        "hexagonal_prism"
      ]
    },
    {
      "id": "B016",
      "title": "Triangular wedge prism",
      "category": "primitive",
      "difficulty": "medium",
      "prompt": "Create one right-triangular wedge prism with an overall X length of 70 mm, Y width of 30 mm, and Z height of 25 mm. Keep its rectangular bottom at Z=0, make the top slope from 25 mm high at X=-35 mm to zero at X=35 mm, center it in Y, and use named parameters.",
      "expected_behavior": "generate",
      "parameterization_required": true,
      "constraints": [
        {
          "id": "overall_dimensions",
          "type": "bbox_dimensions",
          "hard": true,
          "expected_mm": {
            "x": 70,
            "y": 30,
            "z": 25
          },
          "absolute_tolerance_mm": 0.5,
          "relative_tolerance": 0.01
        },
        {
          "id": "base_at_z0",
          "type": "bbox_bounds",
          "hard": true,
          "expected_min_mm": {
            "z": 0
          },
          "absolute_tolerance_mm": 0.5,
          "relative_tolerance": 0.01
        },
        {
          "id": "single_solid",
          "type": "solid_count",
          "hard": true,
          "expected": 1
        }
      ],
      "manual_checks": [
        {
          "id": "single_sloped_face",
          "criterion": "The wedge has one continuous planar slope descending along positive X.",
          "scale": "binary",
          "required": true
        }
      ],
      "tags": [
        "primitive",
        "wedge",
        "triangular_prism"
      ]
    },
    {
      "id": "B017",
      "title": "Four-hole counterbored plate",
      "category": "holes_and_slots",
      "difficulty": "hard",
      "prompt": "Create an 80 x 50 x 12 mm plate with its bottom at Z=0. Add four 6 mm through holes at X=+-30 mm and Y=+-15 mm, and add a 12 mm diameter by 4 mm deep counterbore from the top around every hole. Use named parameters and return one solid.",
      "expected_behavior": "generate",
      "parameterization_required": true,
      "constraints": [
        {
          "id": "overall_dimensions",
          "type": "bbox_dimensions",
          "hard": true,
          "expected_mm": {
            "x": 80,
            "y": 50,
            "z": 12
          },
          "absolute_tolerance_mm": 0.5,
          "relative_tolerance": 0.01
        },
        {
          "id": "single_solid",
          "type": "solid_count",
          "hard": true,
          "expected": 1
        },
        {
          "id": "through_holes",
          "type": "cylindrical_hole_pattern",
          "hard": true,
          "expected_count": 4,
          "diameter_mm": 6,
          "diameter_tolerance_mm": 0.3,
          "axis": "z",
          "through": true
        },
        {
          "id": "counterbores",
          "type": "cylindrical_hole_pattern",
          "hard": true,
          "expected_count": 4,
          "diameter_mm": 12,
          "diameter_tolerance_mm": 0.3,
          "axis": "z",
          "through": false
        }
      ],
      "manual_checks": [
        {
          "id": "counterbore_depth",
          "criterion": "Each 12 mm counterbore is concentric with a through hole and 4 mm deep.",
          "scale": "binary",
          "required": true
        }
      ],
      "tags": [
        "holes",
        "counterbore",
        "plate",
        "four_hole_pattern"
      ]
    },
    {
      "id": "B018",
      "title": "Blind-hole bolt circle block",
      "category": "holes_and_slots",
      "difficulty": "hard",
      "prompt": "Create a 60 x 60 x 20 mm square block centered in X and Y with its bottom at Z=0. Drill four 8 mm diameter blind holes 12 mm deep from the top, equally spaced on a 40 mm pitch circle. Use named parameters and return one solid.",
      "expected_behavior": "generate",
      "parameterization_required": true,
      "constraints": [
        {
          "id": "overall_dimensions",
          "type": "bbox_dimensions",
          "hard": true,
          "expected_mm": {
            "x": 60,
            "y": 60,
            "z": 20
          },
          "absolute_tolerance_mm": 0.5,
          "relative_tolerance": 0.01
        },
        {
          "id": "single_solid",
          "type": "solid_count",
          "hard": true,
          "expected": 1
        },
        {
          "id": "blind_bolt_circle",
          "type": "cylindrical_hole_pattern",
          "hard": true,
          "expected_count": 4,
          "diameter_mm": 8,
          "diameter_tolerance_mm": 0.3,
          "axis": "z",
          "through": false,
          "pitch_circle_diameter_mm": 40,
          "position_tolerance_mm": 0.5
        }
      ],
      "manual_checks": [
        {
          "id": "blind_depth",
          "criterion": "All four blind holes start at the top face and are 12 mm deep.",
          "scale": "binary",
          "required": true
        }
      ],
      "tags": [
        "holes",
        "blind_holes",
        "pcd",
        "block"
      ]
    },
    {
      "id": "B019",
      "title": "Cross-drilled cylinder",
      "category": "holes_and_slots",
      "difficulty": "hard",